{
  "schema_version": 1,
  "run_id": "run-0007",
  "root_seed": 20260826,
  "seed_derivation": {
    "rule": "harness-rng",
    "version": 1
  },
  "clock": {
    "epoch": "2026-01-01T00:00:00.000000Z",
    "tick_interval_us": 1000000,
    "mode": "lockstep",
    "rate": 1.0
  },
  "code_version": {
    "revision": "0000000",
    "dirty": false
  },
  "participants": [],
  "exit_state": {
    "state": "completed"
  },
  "non_reproducible": []
}
